{
  "version": "1.0.0",
  "total": 178,
  "conteoDecisionesOriginales": {
    "A": 28,
    "B": 50,
    "C": 35,
    "D": 5,
    "E": 38,
    "F": 22
  },
  "rotulos": [
    {
      "numero": 1,
      "etiquetaOriginal": "Hive Mind Collectivism",
      "normalizacion": "Colectivismo de mente-colmena",
      "decisionOriginal": "F",
      "tratamientoActual": {
        "clase": "exclusion",
        "equivalenciaConCorriente": false,
        "motivo": "Ficción especulativa de comunidades de memes, sin tradición política delimitada ni fuentes aptas para un resultado personal."
      }
    },
    {
      "numero": 2,
      "etiquetaOriginal": "Nazbol",
      "normalizacion": "Nacionalbolchevismo",
      "decisionOriginal": "B",
      "tratamientoActual": {
        "clase": "region",
        "corrienteId": "nacionalbolchevismo",
        "decisionCapa": "B",
        "publicacionGeometrica": "publicada",
        "equivalenciaConCorriente": true,
        "motivo": "Solo modo exhaustivo: no debe inferirse de patriotismo de izquierda ni equipararse a organizaciones españolas sin evidencia."
      }
    },
    {
      "numero": 3,
      "etiquetaOriginal": "Neo Bolshevism",
      "normalizacion": "Neobolchevismo de *1984*",
      "decisionOriginal": "F",
      "tratamientoActual": {
        "clase": "exclusion",
        "equivalenciaConCorriente": false,
        "motivo": "Ideología ficticia de Eurasia en la novela 1984; no equivale al bolchevismo histórico ni a sus ramas políticas documentadas."
      }
    },
    {
      "numero": 4,
      "etiquetaOriginal": "Ingsocism",
      "normalizacion": "Ingsoc/socialismo inglés de *1984*",
      "decisionOriginal": "F",
      "tratamientoActual": {
        "clase": "exclusion",
        "equivalenciaConCorriente": false,
        "motivo": "Ideología ficticia de la novela 1984; conservarla como celda normalizaría ficción como opción política real."
      }
    },
    {
      "numero": 5,
      "etiquetaOriginal": "Death Worship",
      "normalizacion": "“Culto a la muerte” de *1984*",
      "decisionOriginal": "F",
      "tratamientoActual": {
        "clase": "exclusion",
        "equivalenciaConCorriente": false,
        "motivo": "Rótulo ficticio de 1984 sin doctrina histórica independiente ni utilidad para el matching español."
      }
    },
    {
      "numero": 6,
      "etiquetaOriginal": "Corporatocracy",
      "normalizacion": "Corporatocracia",
      "decisionOriginal": "C",
      "tratamientoActual": {
        "clase": "diagnostico",
        "corrienteId": "corporatocracia",
        "decisionCapa": "B",
        "equivalenciaConCorriente": true,
        "motivo": "Es un diagnóstico institucional, no una identidad que se recomiende al usuario; debe apoyarse en transparencia, lobbies y protección al denunciante, no en una respuesta antiempresa aislada."
      }
    },
    {
      "numero": 7,
      "etiquetaOriginal": "Kraterocracy",
      "normalizacion": "Kraterocracia",
      "decisionOriginal": "F",
      "tratamientoActual": {
        "clase": "contexto",
        "corrienteId": "regeneracionismo-autoritario-primorriverista",
        "decisionCapa": "B",
        "equivalenciaConCorriente": false,
        "motivo": "El gobierno por la fuerza permanece como polo teórico violento, no como identidad que una respuesta autoritaria aislada pueda producir."
      }
    },
    {
      "numero": 8,
      "etiquetaOriginal": "Posadism",
      "normalizacion": "Posadismo",
      "decisionOriginal": "B",
      "tratamientoActual": {
        "clase": "region",
        "corrienteId": "posadismo",
        "decisionCapa": "B",
        "publicacionGeometrica": "publicada",
        "equivalenciaConCorriente": true,
        "motivo": "Es referencia doctrinal residual, no el POSI español; se ofrece solo con profundidad y advertencia explícita."
      }
    },
    {
      "numero": 9,
      "etiquetaOriginal": "Stalinism",
      "normalizacion": "Estalinismo/ML ortodoxo",
      "decisionOriginal": "A",
      "tratamientoActual": {
        "clase": "region",
        "corrienteId": "marxismo-leninismo-estaliniano",
        "decisionCapa": "A",
        "publicacionGeometrica": "publicada",
        "equivalenciaConCorriente": true,
        "motivo": "Referencia histórica para distinguir corrientes comunistas; nunca identifica militancia ni sustituye una valoración por periodo."
      }
    },
    {
      "numero": 10,
      "etiquetaOriginal": "Marxist Leninism Maoism",
      "normalizacion": "Marxismo-leninismo-maoísmo",
      "decisionOriginal": "B",
      "tratamientoActual": {
        "clase": "region",
        "corrienteId": "marxismo-leninismo-maoismo",
        "decisionCapa": "B",
        "publicacionGeometrica": "publicada",
        "equivalenciaConCorriente": true,
        "motivo": "Referencia internacional sensible y exhaustiva; no equivale al maoísmo histórico general ni al Pensamiento Gonzalo."
      }
    },
    {
      "numero": 11,
      "etiquetaOriginal": "Forth Theory",
      "normalizacion": "Cuarta Teoría Política (corrección)",
      "decisionOriginal": "B",
      "tratamientoActual": {
        "clase": "region",
        "corrienteId": "cuarta-teoria-politica",
        "decisionCapa": "B",
        "publicacionGeometrica": "publicada",
        "equivalenciaConCorriente": true,
        "motivo": "La economía no está instrumentada y su influencia española no debe sobredimensionarse; el punto es solo un prior pendiente."
      }
    },
    {
      "numero": 12,
      "etiquetaOriginal": "Mladorossism",
      "normalizacion": "Mladorossismo",
      "decisionOriginal": "E",
      "tratamientoActual": {
        "clase": "contexto",
        "corrienteId": "mladorossismo",
        "decisionCapa": "B",
        "equivalenciaConCorriente": true,
        "motivo": "Contexto extranjero de entreguerras sin equivalente español; evita llamar monárquico-comunista a cualquier combinación de corona y política social."
      }
    },
    {
      "numero": 13,
      "etiquetaOriginal": "Pol Potism",
      "normalizacion": "Polpotismo/Jemeres Rojos",
      "decisionOriginal": "E",
      "tratamientoActual": {
        "clase": "modelo-historico",
        "corrienteId": "polpotismo",
        "decisionCapa": "B",
        "equivalenciaConCorriente": true,
        "motivo": "Solo contexto histórico comparado, con advertencia de víctimas; nunca recomendación, identidad lúdica ni sinónimo de maoísmo general."
      }
    },
    {
      "numero": 14,
      "etiquetaOriginal": "Juche",
      "normalizacion": "Juche",
      "decisionOriginal": "E",
      "tratamientoActual": {
        "clase": "contexto",
        "corrienteId": "juche",
        "decisionCapa": "B",
        "equivalenciaConCorriente": true,
        "motivo": "No tiene equivalente partidario español; se diferencia de no alineamiento, proteccionismo puntual y marxismo-leninismo internacionalista."
      }
    },
    {
      "numero": 15,
      "etiquetaOriginal": "Fascism",
      "normalizacion": "Fascismo histórico por fases",
      "decisionOriginal": "B",
      "tratamientoActual": {
        "clase": "region",
        "corrienteId": "fascismo-italiano-regimen",
        "decisionCapa": "B",
        "publicacionGeometrica": "publicada",
        "equivalenciaConCorriente": true,
        "motivo": "Sirve de comparación histórica, separado de Falange, franquismo, San Sepolcro y la República de Salò."
      }
    },
    {
      "numero": 16,
      "etiquetaOriginal": "Esoteric Fascism",
      "normalizacion": "Fascismo esotérico",
      "decisionOriginal": "B",
      "tratamientoActual": {
        "clase": "contexto",
        "corrienteId": "fascismo-esoterico",
        "decisionCapa": "B",
        "equivalenciaConCorriente": true,
        "motivo": "Solo contexto histórico especializado; no se deriva de religiosidad, tradicionalismo ni una respuesta aislada. El propietario sitúa la recepción española en el evolianismo metapolítico (revistas como Elementos o El Manifiesto): un nicho que lee, no un movimiento de masas."
      }
    },
    {
      "numero": 17,
      "etiquetaOriginal": "Nazism",
      "normalizacion": "Nacionalsocialismo alemán",
      "decisionOriginal": "E",
      "tratamientoActual": {
        "clase": "modelo-historico",
        "corrienteId": "nacionalsocialismo-aleman",
        "decisionCapa": "B",
        "equivalenciaConCorriente": true,
        "motivo": "Referencia histórica violenta, separada de neonazismo posterior, Falange, franquismo y derecha radical electoral; no genera identidad ni recomendación. Recepción española anotada por el propietario: CEDADE como referente histórico de propaganda; el neonazismo español posterior funciona como franquicia importada, sin doctrina propia."
      }
    },
    {
      "numero": 18,
      "etiquetaOriginal": "Neo Nazism",
      "normalizacion": "Neonazismo",
      "decisionOriginal": "B",
      "tratamientoActual": {
        "clase": "region",
        "corrienteId": "neonazismo",
        "decisionCapa": "B",
        "publicacionGeometrica": "publicada",
        "equivalenciaConCorriente": true,
        "motivo": "Referencia sensible e histórica; no se confunde con derecha radical electoral ni con el arquetipo aceleracionista terrorista."
      }
    },
    {
      "numero": 19,
      "etiquetaOriginal": "National Capitalism",
      "normalizacion": "Capitalismo nacional",
      "decisionOriginal": "B",
      "tratamientoActual": {
        "clase": "faceta",
        "corrienteId": "capitalismo-nacional",
        "decisionCapa": "B",
        "equivalenciaConCorriente": true,
        "motivo": "Debe distinguirse del proteccionismo puntual, del corporativismo y de la simple defensa de empresas españolas."
      }
    },
    {
      "numero": 20,
      "etiquetaOriginal": "Alt Right",
      "normalizacion": "Alt-right",
      "decisionOriginal": "D",
      "tratamientoActual": {
        "clase": "contexto",
        "corrienteId": "derecha-alternativa",